{
   "id": "pfitz_04_multi_4th",
   "name": "Pfitzinger/Douglas: Multiple Marathoning, 4-week schedule",
   "description": "\"Multiple Marathoning, 4-week schedule\" from \"Advanced Marathoning\" (fourth edition) by Pete Pfitzinger and Scott Douglas",
   "units": "mi",
   "source": "https://www.amazon.com/dp/1718237472/",
   "type": "Marathon",
   "schedule": [
      {
         "workouts": [
            {
               "title": "Rest or cross-train"
            },
            {
               "title": "Rest or cross-train"
            },
            {
               "title": "Recovery {4-5:6-8}",
               "distance": [
                  4,
                  5
               ]
            },
            {
               "title": "Rest or cross-train"
            },
            {
               "title": "Recovery {5-6:8-10}",
               "distance": [
                  5,
                  6
               ]
            },
            {
               "title": "Recovery {5-6:8-10}",
               "distance": [
                  5,
                  6
               ]
            },
            {
               "title": "Recovery {6-7:10-11}",
               "distance": [
                  6,
                  7
               ]
            }
         ]
      },
      {
         "workouts": [
            {
               "title": "Rest or cross-train"
            },
            {
               "title": "Recovery {6-7:10-11}",
               "distance": [
                  6,
                  7
               ]
            },
            {
               "title": "Gen-aerobic {7-8:11-13}",
               "distance": [
                  7,
                  8
               ]
            },
            {
               "title": "Rest or cross-train"
            },
            {
               "title": "Gen-aerobic + speed {8-9:13-14} with 8 x 100 m strides",
               "distance": [
                  8,
                  9
               ]
            },
            {
               "title": "Recovery {5-6:8-10}",
               "distance": [
                  5,
                  6
               ]
            },
            {
               "title": "Gen-aerobic {10-11:16-18}",
               "distance": [
                  10,
                  11
               ]
            }
         ]
      },
      {
         "workouts": [
            {
               "title": "Rest or cross-train"
            },
            {
               "title": "V̇O₂max {8-9:13-14} with 6 x 600 m at 5K race pace; jog 50%-90% interval time",
               "distance": [
                  8,
                  9
               ]
            },
            {
               "title": "Recovery {4-5:6-8}",
               "distance": [
                  4,
                  5
               ]
            },
            {
               "title": "Med-long run {12-13:19-21}",
               "distance": [
                  12,
                  13
               ]
            },
            {
               "title": "Recovery {3-4:5-6}",
               "distance": [
                  3,
                  4
               ]
            },
            {
               "title": "Recovery + speed {5-6:8-10} with 8 x 100 m strides",
               "distance": [
                  5,
                  6
               ]
            },
            {
               "title": "Gen-aerobic {10-11:16-18}",
               "distance": [
                  10,
                  11
               ]
            }
         ]
      },
      {
         "workouts": [
            {
               "title": "Rest"
            },
            {
               "title": "Recovery {5-6:8-10}",
               "distance": [
                  5,
                  6
               ]
            },
            {
               "title": "Dress rehearsal {6-7:10-11} with {2:3} at marathon pace",
               "distance": [
                  6,
                  7
               ]
            },
            {
               "title": "Recovery {4-5:6-8}",
               "distance": [
                  4,
                  5
               ]
            },
            {
               "title": "Recovery + speed {4-5:6-8} with 6 x 100 m strides",
               "distance": [
                  4,
                  5
               ]
            },
            {
               "title": "Recovery {2-4:3-6}",
               "distance": [
                  2,
                  4
               ]
            },
            {
               "title": "Second marathon",
               "distance": 26.2
            }
         ]
      }
   ]
}