{
   "id": "frr_bb_02",
   "name": "Faster Road Racing: Base Building Schedule 2",
   "description": "\"Base Training 2: Building up to 45 Miles (72 km) per Week\" from \"Faster Road Racing: 5K to Half Marathon\" by Pete D. Pfitzinger and Philip Latter.\"",
   "units": "mi",
   "source": "https://www.amazon.com/Faster-Road-Racing-Half-Marathon/dp/1450470459",
   "type": "Base",
   "schedule": [
      {
         "workouts": [
            {
               "title": "Rest or cross-training"
            },
            {
               "title": "General aerobic {6:10}",
               "distance": 6
            },
            {
               "title": "General aerobic {3:5}",
               "distance": 3
            },
            {
               "title": "General aerobic {4:6}",
               "distance": 4
            },
            {
               "title": "Rest or cross-training"
            },
            {
               "title": "General aerobic {5:9}",
               "distance": 5
            },
            {
               "title": "Endurance {9:14}",
               "distance": 9
            }
         ]
      },
      {
         "workouts": [
            {
               "title": "Rest or cross-training"
            },
            {
               "title": "General aerobic {6:10}",
               "distance": 6
            },
            {
               "title": "General aerobic {3:5}",
               "distance": 3
            },
            {
               "title": "General aerobic {5:8}",
               "distance": 5
            },
            {
               "title": "Rest or cross-training"
            },
            {
               "title": "General aerobic {6:10}",
               "distance": 6
            },
            {
               "title": "Endurance {10:16}",
               "distance": 10
            }
         ]
      },
      {
         "workouts": [
            {
               "title": "Rest or cross-training"
            },
            {
               "title": "General aerobic {6:10}",
               "distance": 6
            },
            {
               "title": "General aerobic {3:5}",
               "distance": 3
            },
            {
               "title": "General aerobic {5:8}",
               "distance": 5
            },
            {
               "title": "Rest or cross-training"
            },
            {
               "title": "General aerobic {6:10}",
               "distance": 6
            },
            {
               "title": "Endurance {10:16}",
               "distance": 10
            }
         ]
      },
      {
         "workouts": [
            {
               "title": "Rest or cross-training"
            },
            {
               "title": "General aerobic {7:11}",
               "distance": 7
            },
            {
               "title": "General aerobic {3:5}",
               "distance": 3
            },
            {
               "title": "General aerobic + speed {6} w/ 8 x 100 m strides {6:10}",
               "description": "General aerobic + speed {6} w/ 8 x 100 m strides {6:10}",
               "distance": 6
            },
            {
               "title": "Rest or cross-training"
            },
            {
               "title": "General aerobic {7:11}",
               "distance": 7
            },
            {
               "title": "Endurance {10:16}",
               "distance": 10
            }
         ]
      },
      {
         "workouts": [
            {
               "title": "Rest or cross-training"
            },
            {
               "title": "General aerobic {7:11}",
               "distance": 7
            },
            {
               "title": "General aerobic {3:5}",
               "distance": 3
            },
            {
               "title": "Lactate threshold {7:11} 18 min tempo run",
               "distance": 7
            },
            {
               "title": "Rest or cross-training"
            },
            {
               "title": "General aerobic {8:13}",
               "distance": 8
            },
            {
               "title": "Endurance {11:18}",
               "distance": 11
            }
         ]
      },
      {
         "workouts": [
            {
               "title": "Rest or cross-training"
            },
            {
               "title": "General aerobic {7:11}",
               "distance": 7
            },
            {
               "title": "General aerobic {3:5}",
               "distance": 3
            },
            {
               "title": "General aerobic + speed {7} w/ 8 x 100 m strides {7:11}",
               "description": "General aerobic + speed {7} w/ 8 x 100 m strides {7:11}",
               "distance": 7
            },
            {
               "title": "Rest or cross-training"
            },
            {
               "title": "General aerobic {8:13}",
               "distance": 8
            },
            {
               "title": "Endurance {11:18}",
               "distance": 11
            }
         ]
      },
      {
         "workouts": [
            {
               "title": "Rest or cross-training"
            },
            {
               "title": "General aerobic {8:13}",
               "distance": 8
            },
            {
               "title": "General aerobic {4:6}",
               "distance": 4
            },
            {
               "title": "Lactate threshold {8:13}",
               "description": "Lactate threshold {8:13}\n20 min tempo run",
               "distance": 7
            },
            {
               "title": "Rest or cross-training"
            },
            {
               "title": "General aerobic {8:13}",
               "distance": 8
            },
            {
               "title": "Endurance {11:18}",
               "distance": 11
            }
         ]
      },
      {
         "workouts": [
            {
               "title": "Rest or cross-training"
            },
            {
               "title": "General aerobic {9:14}",
               "distance": 9
            },
            {
               "title": "General aerobic {4:6}",
               "distance": 4
            },
            {
               "title": "General aerobic + speed {8} w/ 8 x 100 m strides {8:13}",
               "description": "General aerobic + speed {8} w/ 8 x 100 m strides {8:13}",
               "distance": 7
            },
            {
               "title": "Rest or cross-training"
            },
            {
               "title": "General aerobic {9:14}",
               "distance": 9
            },
            {
               "title": "Endurance {12:19}",
               "distance": 12
            }
         ]
      },
      {
         "workouts": [
            {
               "title": "Rest or cross-training"
            },
            {
               "title": "General aerobic {9:14}",
               "distance": 9
            },
            {
               "title": "General aerobic {4:6}",
               "distance": 4
            },
            {
               "title": "Lactate threshold {8:13}",
               "description": "Lactate threshold {8:13}\n22 min tempo run",
               "distance": 8
            },
            {
               "title": "Rest or cross-training"
            },
            {
               "title": "General aerobic {9:14}",
               "distance": 9
            },
            {
               "title": "Endurance {12:19}",
               "distance": 12
            }
         ]
      },
      {
         "workouts": [
            {
               "title": "Rest or cross-training"
            },
            {
               "title": "General aerobic {10:16}",
               "distance": 10
            },
            {
               "title": "General aerobic {5:8}",
               "distance": 4
            },
            {
               "title": "General aerobic + speed {8} w/ 8 x 100 m strides {8:13}",
               "description": "General aerobic + speed {8} w/ 8 x 100 m strides {8:13}",
               "distance": 8
            },
            {
               "title": "Rest or cross-training"
            },
            {
               "title": "General aerobic {10:16}",
               "distance": 10
            },
            {
               "title": "Endurance {12:19}",
               "distance": 12
            }
         ]
      }
   ]
}