{
   "id": "pfitz_04_multi",
   "name": "Pfitzinger/Douglas: Multiple Marathoning, 4-week schedule",
   "description": "\"Multiple Marathoning, 4-week schedule\" from \"Advanced Marathoning\" (third edition) by Pete Pfitzinger and Scott Douglas",
   "units": "mi",
   "source": "https://www.amazon.com/gp/product/149256866X/",
   "type": "Marathon",
   "schedule": [
      {
         "workouts": [
            {
               "title": "Rest or cross-train"
            },
            {
               "title": "Rest or cross-train"
            },
            {
               "title": "Recovery {5:8}",
               "distance": 5
            },
            {
               "title": "Rest or cross-train"
            },
            {
               "title": "Recovery {6:10}",
               "distance": 6
            },
            {
               "title": "Recovery {5:8}",
               "distance": 5
            },
            {
               "title": "Gen-aerobic {8:13}",
               "distance": 8
            }
         ]
      },
      {
         "workouts": [
            {
               "title": "Rest or cross-train"
            },
            {
               "title": "Recovery {6:10}",
               "distance": 6
            },
            {
               "title": "Gen-aerobic {8:13}",
               "distance": 8
            },
            {
               "title": "Rest or cross-train"
            },
            {
               "title": "Gen-aerobic + speed {8:13} with 8 x 100 m strides",
               "distance": 8
            },
            {
               "title": "Recovery {5:8}",
               "distance": 5
            },
            {
               "title": "Med-long run {11:18}",
               "distance": 11
            }
         ]
      },
      {
         "workouts": [
            {
               "title": "Rest or cross-train"
            },
            {
               "title": "VO₂max {8:13} with 5 x 800 m at 5K race pace; jog 50-90% interval time",
               "distance": 8
            },
            {
               "title": "Recovery {5:8}",
               "distance": 5
            },
            {
               "title": "Med-long run {15:24}",
               "distance": 15
            },
            {
               "title": "Recovery {4:6}",
               "distance": 4
            },
            {
               "title": "Recovery + speed {5:8} with 8 x 100 m strides",
               "distance": 5
            },
            {
               "title": "Med-long run {11:18}",
               "distance": 11
            }
         ]
      },
      {
         "workouts": [
            {
               "title": "Rest"
            },
            {
               "title": "Recovery {6:10}",
               "distance": 6
            },
            {
               "title": "Dress rehearsal {7:11} with {2:3} at marathon pace",
               "distance": 7
            },
            {
               "title": "Recovery {6:10}",
               "distance": 6
            },
            {
               "title": "Recovery + speed {5:8} with 6 x 100 m strides",
               "distance": 5
            },
            {
               "title": "Recovery {4:6}",
               "distance": 4
            },
            {
               "title": "Second Marathon",
               "distance": 26.2
            }
         ]
      }
   ]
}