{
   "id": "pfitz_85_recovery_4th",
   "name": "Pfitzinger/Douglas: Marathon 70 to 85 Miles per Week Recovery",
   "description": "\"70 to 85 Miles per Week Recovery: Training Block 5 - Recovery\" from \"Advanced Marathoning\" (fourth edition) by Pete Pfitzinger and Scott Douglas",
   "units": "mi",
   "source": "https://www.amazon.com/dp/1718237472/",
   "type": "Marathon",
   "schedule": [
      {
         "workouts": [
            {
               "title": "Rest or cross-train"
            },
            {
               "title": "Rest or cross-train"
            },
            {
               "title": "Recovery {3-4:5-6}",
               "distance": [
                  3,
                  4
               ]
            },
            {
               "title": "Rest or cross-train"
            },
            {
               "title": "Recovery {4-5:6-8}",
               "distance": [
                  4,
                  5
               ]
            },
            {
               "title": "Rest or cross-train"
            },
            {
               "title": "Recovery {6-7:10-11}",
               "distance": [
                  6,
                  7
               ]
            }
         ]
      },
      {
         "workouts": [
            {
               "title": "Rest or cross-train"
            },
            {
               "title": "Recovery {4-5:6-8}",
               "distance": [
                  4,
                  5
               ]
            },
            {
               "title": "Recovery {5-6:8-10}",
               "distance": [
                  5,
                  6
               ]
            },
            {
               "title": "Rest or cross-train"
            },
            {
               "title": "Recovery {5-6:8-10}",
               "distance": [
                  5,
                  6
               ]
            },
            {
               "title": "Recovery {5-6:8-10}",
               "distance": [
                  5,
                  6
               ]
            },
            {
               "title": "Gen-aerobic {9-10:14-16}",
               "distance": [
                  9,
                  10
               ]
            }
         ]
      },
      {
         "workouts": [
            {
               "title": "Rest or cross-train"
            },
            {
               "title": "Recovery {6-7:10-11}",
               "distance": [
                  6,
                  7
               ]
            },
            {
               "title": "Recovery {5-6:8-10}",
               "distance": [
                  5,
                  6
               ]
            },
            {
               "title": "Rest or cross-train"
            },
            {
               "title": "Gen-aerobic + speed {8-9:13-14} with 8 x 100 m strides",
               "distance": [
                  8,
                  9
               ]
            },
            {
               "title": "Recovery {6-7:10-11}",
               "distance": [
                  6,
                  7
               ]
            },
            {
               "title": "Gen-aerobic {9-10:14-16}",
               "distance": [
                  9,
                  10
               ]
            }
         ]
      },
      {
         "workouts": [
            {
               "title": "Rest or cross-train"
            },
            {
               "title": "Recovery {5-6:8-10}",
               "distance": [
                  5,
                  6
               ]
            },
            {
               "title": "Gen-aerobic {9-10:14-16}",
               "distance": [
                  9,
                  10
               ]
            },
            {
               "title": "Rest or cross-train"
            },
            {
               "title": "Gen-aerobic + speed {8-9:13-14} with 8 x 100 m strides",
               "distance": [
                  8,
                  9
               ]
            },
            {
               "title": "Recovery {6-7:10-11}",
               "distance": [
                  6,
                  7
               ]
            },
            {
               "title": "Med-long run {11-12:18-19}",
               "distance": [
                  11,
                  12
               ]
            }
         ]
      },
      {
         "workouts": [
            {
               "title": "Rest or cross-train"
            },
            {
               "title": "Recovery {5-6:8-10}",
               "distance": [
                  5,
                  6
               ]
            },
            {
               "title": "Gen-aerobic {9-10:14-16}",
               "distance": [
                  9,
                  10
               ]
            },
            {
               "title": "Recovery {5-6:8-10}",
               "distance": [
                  5,
                  6
               ]
            },
            {
               "title": "Gen-aerobic + speed {9-10:14-16} with 8 x 100 m strides",
               "distance": [
                  9,
                  10
               ]
            },
            {
               "title": "Recovery {6-7:10-11}",
               "distance": [
                  6,
                  7
               ]
            },
            {
               "title": "Med-long run {12-13:19-21}",
               "distance": [
                  12,
                  13
               ]
            }
         ]
      }
   ]
}